{
  "title": "להשוות רכב מול הקריטריונים שלכם עם סוכן AI",
  "request": "לבדוק רכב מסוים מול רשימת קריטריונים אישית, ולקבל לכל קריטריון תשובה מגובה במקור: עומד, לא עומד או לא הוכח.",
  "actions": "דרך העבודה המוצעת: פירוק הקריטריונים לשאלות, חיפוש מקורות ראשוניים, התאמה לגרסה ולשוק, סיכום בטבלה ורשימת בדיקות ידניות.",
  "worked": "התרומה כוללת דרך עבודה מסודרת וכללי אימות. לא נמסרו תוצאות של השוואת רכב מסוים או הוכחה להרצה בפועל.",
  "failed": "התאמה פיזית של כיסאות בטיחות ועגלה דורשת בדיקה באולם תצוגה. מחירים ומבצעים דורשים אימות עדכני. אין לבצע רכישה או ליצור קשר עם מוכרים ללא אישור נפרד.",
  "prompt": "המטרה: לבדוק רכב מסוים מול רשימת קריטריונים אישית, ולקבל לכל קריטריון תשובה מגובה במקור: עומד, לא עומד או לא הוכח.\n\nמה להכין:\n- דגם ותצורה מדויקים (למשל דגם, רמת גימור, הנעה) ושנת הייצור.\n- רשימת קריטריונים ברורה וניתנת לבדיקה. דוגמאות: חדש 0 ק\"מ, היברידי מלא בלי הטענה, מחיר סביב סכום מסוים, ISOFIX במושבים האחוריים הקיצוניים, אחריות של 7 שנים, דירוג Euro NCAP, נפח תא מטען, צריכת דלק אמיתית.\n- אילו קריטריונים הם תנאי סף ואילו רצוי.\n- כלים: סוכן עם גישה לחיפוש באינטרנט ולקריאת דפים. אין צורך בהרשאות לחשבונות, ואין ליצור קשר עם סוכנויות.\n\nהשלבים:\n1. בקשו מהסוכן לפרק כל קריטריון לשאלה אחת שאפשר לבדוק.\n2. לכל קריטריון: לחפש מקור ראשוני (אתר היצרן או היבואן, מחירון רשמי, אתר הדירוג עצמו) ורק אחר כך מקורות משניים כמו ביקורות.\n3. לרשום ליד כל תשובה: הממצא, הקישור, והאם זו נתון יצרן או מדידה עצמאית.\n4. לבדוק התאמה לדגם המדויק. דירוג בטיחות, אחריות ונתוני צריכה משתנים בין גרסאות (בנזין מול היברידי, שנתון, שוק).\n5. לסכם בטבלה: קריטריון, תוצאה (עומד / לא עומד / לא הוכח), מקור, הערה.\n6. לסיים ברשימת פעולות לאימות ידני.\n\nהבדיקות:\n- כל שורה מגובה בקישור שפתחתם בעצמכם.\n- נתוני יצרן (למשל \"ליטר ל-100 ק\"מ\") מסומנים כנתוני יצרן ולא כצריכה בפועל.\n- אין \"עומד\" בלי מקור. מה שלא נמצא מסומן \"לא הוכח\".\n- המחיר מתייחס למועד ולשוק הנכונים, וכולל או לא כולל מסים ואגרות באופן מפורש.\n\nהמגבלות: הסוכן לא יכול לבדוק התאמה פיזית, למשל אם שני כיסאות בטיחות ועגלה נכנסים בפועל. את זה בודקים באולם תצוגה. מחירים ומבצעים משתנים, ולכן לוודא מול הסוכנות לפני החלטה. הסוכן לא מבצע רכישה ולא יוצר קשר עם מוכרים בלי אישור נפרד.",
  "tools": "חיפוש באינטרנט וקריאת דפים בלבד; ללא גישה לחשבונות וללא יצירת קשר עם סוכנויות.",
  "evidence": "",
  "english": "A reusable workflow for checking an exact car model against personal criteria. Use primary sources, distinguish manufacturer figures from independent measurements, and report meets, does not meet or not proven for each criterion. No completed car comparison or execution evidence was submitted. Physical fit and current prices need manual verification. Research only; contacting sellers and purchasing require separate approval.",
  "consent": true,
  "author": "נתנאל באבא",
  "submitted_at": "2026-10-06T15:18:01.702Z",
  "issue": "https://github.com/ofershap/agent-success-hub/issues/25"
}
