{
  "title": "להשוות רכב מול הקריטריונים שלכם עם סוכן AI",
  "request": "לבדוק רכב מסוים מול רשימת קריטריונים אישית, ולקבל לכל קריטריון תשובה מגובה במקור: עומד, לא עומד או לא הוכח.",
  "actions": "דרך עבודה מוצעת לשימוש מחדש: לפרק כל קריטריון לשאלה אחת בדיקה, לחפש מקור ראשוני לכל תשובה, לסמן נתוני יצרן מול מדידה עצמאית, להתאים לדגם המדויק, ולסכם בטבלת עומד/לא עומד/לא הוכח עם קישורים.",
  "worked": "התרומה כוללת מתכון כללי עם קלט, שלבים ובדיקות. לא צורפו ראיות להרצה מלאה או לתוצאות בפועל.",
  "failed": "הסוכן לא יכול לבדוק התאמה פיזית, למשל אם שני כיסאות בטיחות ועגלה נכנסים בפועל - את זה בודקים באולם תצוגה. מחירים ומבצעים משתנים, ולכן לוודא מול הסוכנות לפני החלטה.",
  "prompt": "המטרה: לבדוק רכב מסוים מול רשימת קריטריונים אישית, ולקבל לכל קריטריון תשובה מגובה במקור: עומד, לא עומד או לא הוכח.\n\nמה להכין:\n- דגם ותצורה מדויקים (למשל דגם, רמת גימור, הנעה) ושנת הייצור.\n- רשימת קריטריונים ברורה וניתנת לבדיקה. דוגמאות: חדש 0 ק\"מ, היברידי מלא בלי הטענה, מחיר סביב סכום מסוים, ISOFIX במושבים האחוריים הקיצוניים, אחריות של 7 שנים, דירוג Euro NCAP, נפח תא מטען, צריכת דלק אמיתית.\n- אילו קריטריונים הם תנאי סף ואילו רצוי.\n- כלים: סוכן עם גישה לחיפוש באינטרנט ולקריאת דפים. אין צורך בהרשאות לחשבונות, ואין ליצור קשר עם סוכנויות.\n\nהשלבים:\n1. בקשו מהסוכן לפרק כל קריטריון לשאלה אחת שאפשר לבדוק.\n2. לכל קריטריון: לחפש מקור ראשוני (אתר היצרן או היבואן, מחירון רשמי, אתר הדירוג עצמו) ורק אחר כך מקורות משניים כמו ביקורות.\n3. לרשום ליד כל תשובה: הממצא, הקישור, והאם זו נתון יצרן או מדידה עצמאית.\n4. לבדוק התאמה לדגם המדויק. דירוג בטיחות, אחריות ונתוני צריכה משתנים בין גרסאות (בנזין מול היברידי, שנתון, שוק).\n5. לסכם בטבלה: קריטריון, תוצאה (עומד / לא עומד / לא הוכח), מקור, הערה.\n6. לסיים ברשימת פעולות לאימות ידני.\n\nהבדיקות:\n- כל שורה מגובה בקישור שפתחתם בעצמכם.\n- נתוני יצרן (למשל \"ליטר ל-100 ק\"מ\") מסומנים כנתוני יצרן ולא כצריכה בפועל.\n- אין \"עומד\" בלי מקור. מה שלא נמצא מסומן \"לא הוכח\".\n- המחיר מתייחס למועד ולשוק הנכונים, וכולל או לא כולל מסים ואגרות באופן מפורש.\n\nהמגבלות: הסוכן לא יכול לבדוק התאמה פיזית, למשל אם שני כיסאות בטיחות ועגלה נכנסים בפועל. את זה בודקים באולם תצוגה. מחירים ומבצעים משתנים, ולכן לוודא מול הסוכנות לפני החלטה. הסוכן לא מבצע רכישה ולא יוצר קשר עם מוכרים בלי אישור נפרד.",
  "tools": "סוכן עם גישה לחיפוש באינטרנט ולקריאת דפים. אין צורך בהרשאות לחשבונות, ואין ליצור קשר עם סוכנויות.",
  "evidence": "",
  "english": "Check a specific car against your own criteria list with an AI agent, and get a sourced verdict per criterion: meets, does not meet, or unproven. Break each criterion into one checkable question, prefer primary sources (manufacturer/importer, official price list, the rating body itself), label manufacturer data vs independent measurement, match the exact trim and market, and close with a manual-verification list. The agent cannot test physical fit and never contacts dealers or buys anything. This is a proposed reusable workflow, not independent evidence of a completed run.",
  "consent": true,
  "author": "נתנאל באבא",
  "submitted_at": "2026-10-06T15:18:01.702Z",
  "slug": "submission-muwtp6nahqu4"
}