{
 "title": "לתקן באג עם סוכן קוד: מקור רשמי, תיקון קטן ובדיקה שאפשר להיכשל בה",
 "request": "לתקן באג בקוד בעזרת תיעוד רשמי ובדיקות, בלי להסתפק ב\"הסוכן אמר שזה עובד\". הדוגמה: פונקציית Python שקוראת קובץ TOML ונכשלת כי הקובץ נפתח כטקסט במקום כבתים.",
 "actions": "שמירת הכשל המקורי, קריאת המקור הרשמי (tomllib.load ב-Python 3.11), תיקון של שורה אחת בלבד (פתיחה ב-rb), והרצת בדיקות לפני ואחרי: קובץ תקין, קובץ חסר ו-TOML פגום. השוואת הקוד הסופי למקורות ודיווח מה לא נבדק.",
 "worked": "ברשומת הניסוי הציבורית של DDD תועד הכשל ב-Python 3.11.15, תיקון של שורה אחת, שתי בדיקות unittest שעברו ובדיקה נוספת ל-TOML פגום. בהכנת המתכון שוחזרו בנפרד הכשל והתיקון ב-Python 3.11.16 על Linux: ארבע בדיקות עברו, כולל בדיקה שמוודאת שהקוד המקורי נכשל. בסקירת הקבלה של הספרייה שוחזרו הכשל והתיקון שוב בעצמאות (tomli, הבקפורט הזהה של tomllib): כל ארבע הטענות אומתו.",
 "failed": "זה ניסוי מקומי בפונקציה קטנה. הוא לא מוכיח ש-DDD עדיף על עבודה בלעדיו, לא מודד חיסכון בזמן ולא מאמת כל סוכן, מערכת הפעלה או סוג TOML. המתכון המוצע עצמו לא הורץ מקצה לקצה עם סוכן נוסף.",
 "prompt": "המטרה\nלתקן באג בקוד בעזרת תיעוד רשמי ובדיקות, בלי להסתפק ב\"הסוכן אמר שזה עובד\". הדוגמה: פונקציית Python שקוראת קובץ TOML ונכשלת כי הקובץ נפתח כטקסט במקום כבתים.\n\nמה להכין\nסוכן קוד עם גישה לקבצים, לתיעוד ולטרמינל; Python 3.11; תיקיית ניסוי ללא מידע פרטי. אם מתקינים DDD, מאשרים את ההתקנה בנפרד:\nnpx skills add romiluz13/ddd --skill ddd ddd-scope ddd-ground ddd-verify\nה-CLI הניסיוני של DDD אינו נדרש. מגדירים שהסוכן רשאי לערוך ולהריץ בדיקות רק בתיקיית הניסוי, בלי פרסום או שינוי סביבה גלובלית.\n\nהבקשה לסוכן\n\"השתמש ב-DDD למשימה הזאת. בדוק את load_settings מול התיעוד הרשמי של גרסת Python בפועל. שמור את הכשל המקורי, קרא את המקורות, תכנן תיקון קטן ואז בצע אותו בתיקיית הניסוי. אל תשנה את הממשק, אל תסתיר חריגות ואל תוסיף תלות. שמור הערה אחת שמקשרת מקור להחלטה ולבדיקה. בסיום הראה diff, פקודות ותוצאות בפועל, ומה לא נבדק.\"\n\nהשלבים\n1. יוצרים settings.py עם הקוד הבא:\nimport tomllib\n\ndef load_settings(path):\n    with open(path, \"r\", encoding=\"utf-8\") as stream:\n        return tomllib.load(stream)\n\n2. יוצרים קובץ settings.toml תקין עם תוכן UTF-8:\n[app]\nname = \"שלום\"\nport = 8000\n\n3. בודקים את גרסת Python. מריצים קריאה לקובץ ושומרים את השגיאה לפני התיקון. אל תשנו את הבדיקה כדי להעלים את הכשל.\n4. קוראים את tomllib.load בתיעוד Python 3.11. הדרישה היא קובץ פתוח לקריאה בינארית. בודקים גם את open ואת התנהגות החריגות.\n5. מחליפים רק את שורת הפתיחה ל:\n    with open(path, \"rb\") as stream:\nמשאירים את החזרת המילון ואת החריגות כפי שהן.\n6. בודקים קובץ תקין, קובץ חסר ו-TOML פגום. משווים את הקוד הסופי למקורות, קוראים את ה-diff ושומרים תוצאות.\n\nהבדיקות\nלפני התיקון: הקריאה לקובץ התקין נכשלת ב-TypeError.\nאחרי התיקון: מתקבל המילון\n{\"app\": {\"name\": \"שלום\", \"port\": 8000}}.\nקובץ חסר: FileNotFoundError מגיע לקורא.\nTOML פגום: TOMLDecodeError מגיע לקורא.\nאין תלות חדשה או שינוי מחוץ לתיקיית הניסוי. \"עבר\" נכתב רק אחרי הרצה, לא אחרי כתיבת בדיקה.\n\nמה עבד בפועל\nברשומת הניסוי הציבורית של DDD תועד הכשל ב-Python 3.11.15, תיקון של שורה אחת, שתי בדיקות unittest שעברו ובדיקה נוספת ל-TOML פגום. בהכנת המתכון שוחזרו בנפרד הכשל והתיקון ב-Python 3.11.16 על Linux: ארבע בדיקות עברו, כולל בדיקה שמוודאת שהקוד המקורי נכשל. השחזור בדק את ההתנהגות, לא הרצת סוכן עם DDD.\n\nהמגבלות\nזה ניסוי מקומי בפונקציה קטנה. הוא לא מוכיח ש-DDD עדיף על עבודה בלעדיו, לא מודד חיסכון בזמן ולא מאמת כל סוכן, מערכת הפעלה או סוג TOML. המתכון המוצע עצמו לא הורץ מקצה לקצה עם סוכן נוסף.\n\nמקורות\nהפרויקט: https://github.com/romiluz13/ddd\nרשומת הניסוי: https://github.com/romiluz13/ddd/blob/main/.ddd/notes/walkthroughs/python-comparison.md\nתיעוד: https://docs.python.org/3.11/library/tomllib.html",
 "tools": "סוכן קוד עם גישה לקבצים, לתיעוד ולטרמינל; Python 3.11; תיקיית ניסוי ללא מידע פרטי",
 "evidence": "https://github.com/romiluz13/ddd/blob/main/.ddd/notes/walkthroughs/python-comparison.md",
 "english": "Fix a bug with a coding agent using official docs and tests, not 'the agent said it works'. Example: a Python TOML loader failing because the file was opened in text mode. Keep the original failure, read the official tomllib.load docs, change only the open line to binary mode (rb), and run tests before and after: valid file, missing file, broken TOML. The TypeError, the fixed result, FileNotFoundError and TOMLDecodeError behavior were reproduced independently during library review (tomli, the identical tomllib backport). This is a small local experiment: it does not prove DDD outperforms working without it. Installing the DDD CLI is not required; if chosen, approve the install separately.",
 "consent": true,
 "author": "",
 "submitted_at": "2026-10-09T12:46:51.026Z",
 "slug": "submission-mv0ymbo2zyvb"
}