{
  "title": "לחבר קטעי וידאו לסרטון רציף בלי לאבד קריינות",
  "request": "לחבר קטעי וידאו לסרטון רציף בלי לאבד קריינות.",
  "actions": "דרך עבודה מוצעת לשימוש מחדש: Plan narration and render limits, inspect each segment and seam, keep source files and verify the complete encoded video and audio.",
  "worked": "התרומה כוללת מתכון כללי עם קלט, שלבים ובדיקות. לא צורפו ראיות להרצה מלאה או לתוצאות בפועל.",
  "failed": "אין הבטחה לתפר בלתי נראה או אפס תיקונים. מחיר ומגבלות משתנים בין מנועים. קטע חסר מסומן כתוצר חלקי.",
  "prompt": "המטרה\nלחבר קטעי וידאו לסרטון רציף בלי לאבד קריינות.\n\nמה להכין\nהכינו תסריט, קריינות ותמונה עם זכויות שימוש. קבעו קהל, מגבלת אורך ותקציב רינדור ותיקונים. אין צורך להשתמש בדמות או בקול מזוהים.\nVideo engine\nffmpeg\nffprobe\nVideo player\nממלאים [כלי], [חשבון], [יעד] ו[בעל סמכות] לפני עבודה. גישה אינה רשות לשנות, לשתף או לשלם. כסף, מסירה לאדם אחר ופרסום דורשים אישור נפרד של המצב הסופי.\n\nהשלבים\n1. בדקו במנוע [כלי] אם אפשר לתת תמונת פתיחה ושמע, ומהן מגבלות האורך, הפורמט והעלות כעת.\n2. חלקו את הקריינות בהפסקות טבעיות. חשבו את משך הקובץ המקודד. אל תחתכו מילים או תאיצו כדי להתאים.\n3. הפיקו קטע ראשון. בדקו איזה שמע נבחר בפועל, לא רק מה הושמע בתצוגה. קבלו את הקטע רק אחרי צפייה והאזנה.\n4. חלצו את הפריים האחרון המפוענח כתמונת פתיחה לקטע הבא. שמרו כל מקור לפני חיבור.\n5. צפו בסוף הקטע הקודם ובתחילת הבא. בדקו פנים, לבוש, רקע, חפצים, תנוחה, קול וסנכרון. תקנו תפר לפני המשך.\n6. בדקו סחיפה לאורך הרצף כולו. תפר דומה אינו מבטיח זהות יציבה. תיקון נוסף נשאר בתוך התקציב המאושר.\n7. חברו רק קטעים שאושרו. השוו את המאסטר לכל הקריינות המקורית. צפו והאזינו מהתחלה לסוף לפני מסירה לקהל שאושר.\n\nהבדיקות\nכל המילים נשמרו. כל תפר נצפה ונשמע. אין שינוי דמות או קול לא מכוון. המשך והפורמט תקינים. הזכויות, העלות והקהל אושרו.\n\nהמגבלות\nאין הבטחה לתפר בלתי נראה או אפס תיקונים. מחיר ומגבלות משתנים בין מנועים. קטע חסר מסומן כתוצר חלקי.",
  "tools": "Video engine, ffmpeg, ffprobe, Video player",
  "evidence": "",
  "english": "Plan narration and render limits, inspect each segment and seam, keep source files and verify the complete encoded video and audio. This is a proposed reusable workflow, not independent evidence of a completed run. Check the full Hebrew recipe and its limits. Account changes, communications, publication and spending require separate approval.",
  "consent": true,
  "author": "גל מוסקוביץ׳",
  "submitted_at": "2026-10-07T07:47:24.372Z",
  "slug": "submission-muxt1j6czek6"
}
