{
  "title": "לעבור מריצה יבשה לפעולה אחת מאושרת בלי לשלוח פעמיים",
  "request": "לעבור מריצה יבשה לפעולה אחת מאושרת בלי לשלוח פעמיים.",
  "actions": "דרך עבודה מוצעת לשימוש מחדש: Prepare a dry run, test failures, review the final destination and content, approve one action, execute once and verify receipt before any retry.",
  "worked": "התרומה כוללת מתכון כללי עם קלט, שלבים ובדיקות. לא צורפו ראיות להרצה מלאה או לתוצאות בפועל.",
  "failed": "תוצאה לא ודאית נשארת לא ודאית. הודעת הצלחה פנימית אינה הוכחת קבלה. פעולה אחת אינה היתר לרצף פעולות או הוכחת אמינות לכל היעדים.",
  "prompt": "המטרה\nלעבור מריצה יבשה לפעולה אחת מאושרת בלי לשלוח פעמיים.\n\nמה להכין\nהכינו [פעולה], יעד, זהות, תוכן וקבצים, גרסה, מאשר ומתג עצירה. בחרו סביבת בדיקה כשאפשר.\nDRY_RUN\nAPI\nBrowser\nAudit log\nממלאים [כלי], [חשבון], [יעד] ו[בעל סמכות] לפני עבודה. גישה אינה רשות לשנות, לשתף או לשלם. כסף, מסירה לאדם אחר ופרסום דורשים אישור נפרד של המצב הסופי.\n\nהשלבים\n1. חסמו שליחה כברירת מחדל. בדקו שהריצה היבשה מכינה נתונים ולא גורמת להשפעה חיצונית.\n2. הריצו מקרים של יעד סגור, שדה חסר, קובץ שגוי, תקלה ואתגר גישה. כל עמימות משאירה שליחה חסומה.\n3. הציגו למאשר את היעד, הזהות, התוכן, הקבצים וההשלכות. קבלו אישור לפעולה אחת ולתוקף מוגדר.\n4. בדקו שוב את היעד והגרסה. תנו לפעולה מזהה קבוע. מנעו ריצות מקבילות. פתחו חריג לפעולה הזאת בלבד.\n5. בצעו פעם אחת. בתגובה חסרה או בהפסקת חיבור, בדקו ביעד אם הפעולה נקלטה לפני ניסיון נוסף.\n6. קראו אישור חיצוני ספציפי. בדיקת קבלה במייל היא בדיקה נפרדת. החזירו חסימה גם בכשל. דווחו מה לא אומת.\n\nהבדיקות\nהריצה היבשה אינה שולחת. מתג העצירה עובד. ההרשאה תואמת למצב שנשלח. יש ראיה מהיעד. אין כפילות. החסימה הוחזרה.\n\nהמגבלות\nתוצאה לא ודאית נשארת לא ודאית. הודעת הצלחה פנימית אינה הוכחת קבלה. פעולה אחת אינה היתר לרצף פעולות או הוכחת אמינות לכל היעדים.",
  "tools": "DRY_RUN, API, Browser, Audit log",
  "evidence": "",
  "english": "Prepare a dry run, test failures, review the final destination and content, approve one action, execute once and verify receipt before any retry. This is a proposed reusable workflow, not independent evidence of a completed run. Check the full Hebrew recipe and its limits. Account changes, communications, publication and spending require separate approval.",
  "consent": true,
  "author": "גל מוסקוביץ׳",
  "submitted_at": "2026-10-07T07:46:13.553Z",
  "slug": "submission-muxt00j56rwc"
}
