{
  "title": "למפות גישה לחשבונות בלי לאסוף סודות",
  "request": "למפות גישה לחשבונות בלי לאסוף סודות.",
  "actions": "דרך עבודה מוצעת לשימוש מחדש: Record account identifiers and roles without secrets, distinguish saved credentials from tested access and verify permission separately.",
  "worked": "התרומה כוללת מתכון כללי עם קלט, שלבים ובדיקות. לא צורפו ראיות להרצה מלאה או לתוצאות בפועל.",
  "failed": "כניסה יכולה לפוג. פרטי כניסה שמורים אינם הוכחה שהם תקינים. גישה אינה אישור לשינוי.",
  "prompt": "המטרה\nלמפות גישה לחשבונות בלי לאסוף סודות.\n\nמה להכין\nהכינו שירותים, חשבונות שבבעלותכם ומה צריך לבדוק.\nAccount settings\nVault\nממלאים [כלי], [חשבון], [יעד] ו[בעל סמכות] לפני עבודה. גישה אינה רשות לשנות, לשתף או לשלם. כסף, מסירה לאדם אחר ופרסום דורשים אישור נפרד של המצב הסופי.\n\nהשלבים\n1. רשמו שירות וחשבון. אל תכתבו סיסמאות או מפתחות.\n2. בדקו בנפרד חיבור פעיל, פרטי כניסה שמורים וכניסה שנבדקה.\n3. בצעו בדיקת קריאה קטנה בחשבון מורשה.\n4. רשמו תפקיד: בעלים, מנהל או קורא. אחסון אינו שליטה בדומיין.\n5. רשמו זמן ומקור. סמנו מה לא ניתן לבדוק.\n6. מסרו מלאי פרטי. לפני פעולה בדקו מחדש גישה וסמכות.\n\nהבדיקות\nאין סודות. החשבונות נפרדים. גישה ואישור פעולה מופיעים כשתי שאלות.\n\nהמגבלות\nכניסה יכולה לפוג. פרטי כניסה שמורים אינם הוכחה שהם תקינים. גישה אינה אישור לשינוי.",
  "tools": "Account settings, Vault",
  "evidence": "",
  "english": "Record account identifiers and roles without secrets, distinguish saved credentials from tested access and verify permission separately. This is a proposed reusable workflow, not independent evidence of a completed run. Check the full Hebrew recipe and its limits. Account changes, communications, publication and spending require separate approval.",
  "consent": true,
  "author": "גל מוסקוביץ׳",
  "submitted_at": "2026-10-07T11:48:55.351Z",
  "slug": "submission-muy1o4hjmiz1"
}
