{
  "title": "עיצוב ובניית אתר עם סוכן, מבריף עד בדיקה חיה",
  "request": "להפוך מטרה ותוכן למערכת עיצוב ולאתר רספונסיבי שמיש. זו דרך עבודה שאפשר לשתף, לא העתקת אתר אישי או הוראות פנימיות של שירות. התוצר כולל החלטות עיצוב, קוד, בדיקות ומסירה, לא רק צילום יפה.",
  "actions": "להפוך מטרה ותוכן למערכת עיצוב ולאתר רספונסיבי שמיש. זו דרך עבודה שאפשר לשתף, לא העתקת אתר אישי או הוראות פנימיות של שירות. התוצר כולל החלטות עיצוב, קוד, בדיקות ומסירה, לא רק צילום יפה.",
  "worked": "עצב ובנה אתר למטרה שהוגדרה, עם תוכן מאושר ופעולה ראשית ברורה. שמור preview לביקורת עד אישור פרסום. באתר קיים שמור כתובות, תוכן, functionality וזהות אלא אם התבקשת לשנותם. המתכון מוצע, לא נטען שנבדק מחדש מקצה לקצה על פרויקט עצמאי.",
  "failed": "build אינו עיצוב שנבדק. screenshot לפני טעינת תמונה מטעה. RTL עם מספרים/קוד דורש בדיקה. CSS global יכול לשבור component אחר. mock form אינו form פעיל. צילום אחד אינו בדיקת כל המסכים או נגישות. אלה סיכוני יישום, לא טענות לתוצאה עסקית.",
  "prompt": "```text\n# טיוטה: עיצוב ובניית אתר עם סוכן, מבריף עד בדיקה חיה\n\n## היכולת\nלהפוך מטרה ותוכן למערכת עיצוב ולאתר רספונסיבי שמיש. זו דרך עבודה שאפשר לשתף, לא העתקת אתר אישי או הוראות פנימיות של שירות. התוצר כולל החלטות עיצוב, קוד, בדיקות ומסירה, לא רק צילום יפה.\n\n## המתכון לסוכן חדש\n\n### מטרה\nעצב ובנה אתר למטרה שהוגדרה, עם תוכן מאושר ופעולה ראשית ברורה. שמור preview לביקורת עד אישור פרסום. באתר קיים שמור כתובות, תוכן, functionality וזהות אלא אם התבקשת לשנותם. המתכון מוצע, לא נטען שנבדק מחדש מקצה לקצה על פרויקט עצמאי.\n\n### קלט והרשאות\n- קהל, מה הוא צריך לדעת/לעשות ומה נחשב הצלחה. לא בוחרים יעד עסקי במקום הבעלים.\n- סוג האתר, דפים, שפות/RTL, תוכן מאושר, brand assets, תמונות עם זכויות וקישורים.\n- 2-4 references והסבר מה אהבו בהם. לומדים hierarchy/spacing, לא מעתיקים מותג ונכסים.\n- ריפו, stack/runtime/lockfile, hosting/domain וחשבון בעלים. באתר חדש בחר stack מינימלי והצג tradeoffs לפני החלטה גדולה.\n- דרישות פונקציונליות: טפסים, API, search, analytics, auth. לכל תכונה פרטיות ועלות. אין טופס שנראה פעיל אך אינו מחובר.\n- הרשאות לגישה, עריכה ופרסום בנפרד; preview/branch ומי מאשר. תוכן חסר נשאר blocker או placeholder מסומן ב-preview, לא עובדה מומצאת ב-production.\n\n### כלים\nעורך קוד, Git, runtime של הפרויקט, dev server, build/tests, browser לצילומי viewport ובדיקות קישורים/נגישות. HTML/CSS/JS מספיקים לאתר פשוט; שמור framework קיים כשאין סיבה להחליפו. נכסים ושירותים בתשלום דורשים אישור.\n\n### שלבים\n1. קרא את האתר והריפו: דפים, routes, components, style tokens, build/deploy ו-tests. בדוק git ושינויים מקבילים. שמור baseline screenshots ורשימת כתובות.\n2. כתוב brief קצר: קהל, פעולה ראשית, תוכן חובה, מגבלות וסגנון. אסוף תוכן חסר. אין testimonials, שמות לקוחות או מספרי הצלחה מומצאים.\n3. פתח references וצפה בפיקסלים. נתח כותרת/טקסט, grid, רוחב תוכן, contrast, תמונות ו-spacing. תעד מה תאמץ ומה לא; screenshot של אתר אחר אינו עיצוב שלך.\n4. בנה information architecture: דפים/sections, פעולה ראשית וניווט. סדר נקבע מהבריף, לא מתבנית קבועה. שרטט wireframe ברוחב קטן לפני צבעים.\n5. הגדר design tokens: background/surface/text/action, פונט תומך בשפות, טיפוגרפיה, spacing, radius ורוחב מרבי. בדוק contrast ושמור עקביות במקום ערכים אקראיים.\n6. בנה preview של כיוון אחד עם תוכן אמיתי ושלד מלא. ברור מי האתר, למי ומה עושים. כשיש החלטת brand משמעותית הצג אותה לבעלים לפני בנייה מלאה.\n7. כתוב semantic HTML: header/nav/main/footer, headings לפי hierarchy, button לפעולה ו-link לניווט, labels לטופס ו-alt מועיל. אל תשתמש ב-clickable div שאינו נגיש למקלדת.\n8. בנה mobile-first עם grid/flex ויחידות גמישות. breakpoints במקום שבו התוכן נשבר. ב-RTL השתמש ב-logical properties וב-direction מתאים לקוד/URLs. בדוק טקסט ארוך ושפה מעורבת.\n9. השתמש רק בנכסים מאושרים. הגדר מידות תמונה למניעת קפיצות layout, גדלים מתאימים ו-loading מתאים. הטקסט נשאר טקסט. אין תוכן בסיסי שחייב אנימציה כדי להופיע.\n10. חבר רק תכונות בסקופ. טופס: validation, success/error, יעד נתונים מאושר, privacy/consent והגנת spam לפי סיכון. אין API secret בקוד לקוח. חיפוש: loading/empty/error. auth/payment דורשים תכנון והרשאה נפרדים, לא mock שמתחזה לפעיל.\n11. הרץ build/lint/tests. בדוק routes, links, 404, title/meta/canonical לפי התוכן והיעדר מידע פרטי ב-assets/source maps. preview לא יהיה ציבורי/indexed בלי כוונה מאושרת.\n12. פתח בדפדפן ובדוק פיקסלים: viewport צר (~390px), בינוני ורחב (~1440px), zoom 200%, תוכן ארוך וטעינה מלאה. בדוק overflow, crop, footer, sticky/menu/RTL ומצבי טופס. שמור screenshots למסכים/מצבים חשובים, תקן ובדוק שוב.\n13. בדוק keyboard-only: tab order, focus visible, enter/space, escape ל-dialog; reduced motion ונגישות בסיסית. בדיקות אוטומטיות משלימות בדיקה ידנית, לא מחליפות אותה.\n14. מסור preview עם diff, החלטות ו-known gaps. לפני פרסום אמת מחדש account/domain/branch. קבל אישור לתוכן הסופי ולאudience. אישור עיצוב אינו אישור לרכוש domain או לשנות DNS שמשבית אתר.\n15. פרסם ב-hosting מאושר, קרא deploy result ופתח URL שהתקבל. אמת את הדף, assets/routes/actions וגדלי המסך. HTTP 200 אינו הוכחה. כשל deploy משאיר live קודם; אין bypass שקט של checks.\n16. מסור URL חי, commit, commands לשחזור, tokens/components, gaps ו-rollback. תעד איפה עורכים תוכן ואיך בודקים. אין הבטחת SEO/conversion על סמך redesign בלבד.\n\n### בדיקות\nתוכן displayed מול מאושר; build; routes/links; סודות; mobile/desktop pixels; RTL; images loaded; form success/error; keyboard/focus; zoom/contrast; loading/empty; console/network errors; production readback. טופס נבדק רק עם נתוני בדיקה ונמען מורשים.\n\n### מוכן\nאין placeholder לא מאושר; פעולה ברורה; אין חיתוך או overflow לא מכוון; פונקציות עובדות או מסומנות לא מוכנות; pixels בגדלים רלוונטיים נבדקו; owner review ופרסום במסגרת הרשאה; URL חי אומת ו-rollback קיים. preview מוכן אינו אתר שפורסם.\n\n### מלכודות ומגבלות\nbuild אינו עיצוב שנבדק. screenshot לפני טעינת תמונה מטעה. RTL עם מספרים/קוד דורש בדיקה. CSS global יכול לשבור component אחר. mock form אינו form פעיל. צילום אחד אינו בדיקת כל המסכים או נגישות. אלה סיכוני יישום, לא טענות לתוצאה עסקית.\n\n## מקורות שנקראו\nhttps://developer.mozilla.org/en-US/docs/Learn_web_development/Core/CSS_layout/Responsive_Design\nhttps://www.w3.org/WAI/tutorials/page-structure/\n```",
  "tools": "הכלים והסביבה מפורטים במתכון המלא.",
  "evidence": "",
  "english": "A proposed workflow for designing and building a responsive website with a personal AI agent, from approved brief and design references to implementation, accessibility checks, visual review and live deployment verification. It keeps previews separate from publication and preserves existing routes and functionality. A successful build alone does not verify design, working forms, accessibility or business outcomes.",
  "consent": true,
  "author": "ofershap",
  "submitted_at": "2026-10-06T12:59:02Z",
  "issue": "https://github.com/ofershap/agent-success-hub/issues/11"
}
