{
  "title": "לבדוק חיוב כפול ואת ההחזר שהגיע בפועל",
  "request": "לבדוק חיוב כפול ואת ההחזר שהגיע בפועל.",
  "actions": "דרך עבודה מוצעת לשימוש מחדש: Identify each transaction, preserve the intended purchase, review any partial refund and verify the refund independently in the bank.",
  "worked": "התרומה כוללת מתכון כללי עם קלט, שלבים ובדיקות. לא צורפו ראיות להרצה מלאה או לתוצאות בפועל.",
  "failed": "הודעת ״טופל״ אינה זיכוי בנקאי. המתכון לא מבטיח החזר. לא שולחים מספר כרטיס מלא.",
  "prompt": "המטרה\nלבדוק חיוב כפול ואת ההחזר שהגיע בפועל.\n\nמה להכין\nהכינו חשבוניות, שני חיובים, יתרת מוצר ותיאור של הקנייה הרצויה.\nInvoice\nBank statement\nממלאים [כלי], [חשבון], [יעד] ו[בעל סמכות] לפני עבודה. גישה אינה רשות לשנות, לשתף או לשלם. כסף, מסירה לאדם אחר ופרסום דורשים אישור נפרד של המצב הסופי.\n\nהשלבים\n1. בדקו אם יש שתי עסקאות. מסך ריק אחרי תשלום אינו הוכחת כשל.\n2. זהו איזה חיוב נשאר ואיזה מבוטל. אל תשתמשו בקרדיטים שבבירור.\n3. הכינו פנייה עם סכומים וראיות. הציגו נמען ונוסח לאישור לפני שליחה.\n4. אם מוצע החזר חלקי, הציגו עמלה ושינוי ביתרת המוצר. בקשו החלטה.\n5. שמרו אישור טיפול. בדקו את היתרה.\n6. בדקו את ההחזר בבנק בנפרד. השוו ברוטו, עמלה ונטו.\n\nהבדיקות\nהעסקה הרצויה נשמרה. היתרה נבדקה. החזר חלקי אינו מתואר כמלא.\n\nהמגבלות\nהודעת ״טופל״ אינה זיכוי בנקאי. המתכון לא מבטיח החזר. לא שולחים מספר כרטיס מלא.",
  "tools": "Invoice, Bank statement",
  "evidence": "",
  "english": "Identify each transaction, preserve the intended purchase, review any partial refund and verify the refund independently in the bank. This is a proposed reusable workflow, not independent evidence of a completed run. Check the full Hebrew recipe and its limits. Account changes, communications, publication and spending require separate approval.",
  "consent": true,
  "author": "גל מוסקוביץ׳",
  "submitted_at": "2026-10-07T09:29:45.537Z",
  "slug": "submission-muxwp5q9ss3v"
}
