{
  "title": "להחליף אתר עם הפניות, בדיקת לידים ודרך חזרה",
  "request": "להחליף אתר עם הפניות, בדיקת לידים ודרך חזרה.",
  "actions": "דרך עבודה מוצעת לשימוש מחדש: Back up and test restoration, map old URLs to new URLs, test redirects and forms, obtain release approval and monitor the live result.",
  "worked": "התרומה כוללת מתכון כללי עם קלט, שלבים ובדיקות. לא צורפו ראיות להרצה מלאה או לתוצאות בפועל.",
  "failed": "מעבר טכני אינו הוכחת שימור דירוג או תנועה. מפת אתר שהתקבלה אינה הוכחה שכל הדפים מאונדקסים. שינוי באחסון מחייב בדיקה מחדש.",
  "prompt": "המטרה\nלהחליף אתר עם הפניות, בדיקת לידים ודרך חזרה.\n\nמה להכין\nהכינו [אתר ישן], כתובות, תכנים, יעדי טפסים, מדדי בסיס, גישה מורשית לאחסון ולדומיין ואישור נפרד לפרסום.\nGit\nBackup\nHTTP checks\nBrowser\nSearch Console\nממלאים [כלי], [חשבון], [יעד] ו[בעל סמכות] לפני עבודה. גישה אינה רשות לשנות, לשתף או לשלם. כסף, מסירה לאדם אחר ופרסום דורשים אישור נפרד של המצב הסופי.\n\nהשלבים\n1. אספו כתובות ממפת אתר, סריקה ונתוני חיפוש. סמנו דפים חשובים ותנועה קיימת. שמרו גרסה ומדדי בסיס.\n2. גבו קבצים, מדיה, מסד נתונים והגדרות. בדקו שניתן לקרוא ולהחזיר את הגיבוי. שמרו מחוץ לנתיב ציבורי.\n3. בנו מפת ישן מול חדש. שמרו כתובות כשאפשר. כתובת שהוחלפה מפנה בקביעות ליעד מתאים, לא כולן לדף הבית.\n4. בנו סביבת בדיקה חסומה לאינדוקס. בדקו תוכן, כותרות, כתובת קנונית, קישורים ומפת אתר. אל תשנו מחירים או הצעות בלי אישור.\n5. בדקו כל הפניה: קוד, יעד סופי, לולאה ושרשרת. בדקו טפסים ביעד שאושר. תעדו חריגים.\n6. קבעו תנאי חזרה, אחראי וגרסה מדויקת. תרגלו שחזור בטוח. הציגו בדיקות וקבלו אישור למעבר.\n7. אחרי פרסום קראו את הגרסה החיה. בדקו בטלפון ובמחשב והוכיחו הגעת פנייה ליעד המאושר.\n8. בדקו דפים חשובים בכלי החיפוש. השוו שגיאות, אינדוקס ותנועה באותם חלונות זמן. כשל קריטי מפעיל חזרה.\n\nהבדיקות\nגיבוי קריא. שחזור נבדק. מפת הפניות שלמה עם חריגים. גרסה חיה נכונה. טופס הגיע ליעד. תצוגה נבדקה בשני גדלים.\n\nהמגבלות\nמעבר טכני אינו הוכחת שימור דירוג או תנועה. מפת אתר שהתקבלה אינה הוכחה שכל הדפים מאונדקסים. שינוי באחסון מחייב בדיקה מחדש.",
  "tools": "Git, Backup, HTTP checks, Browser, Search Console",
  "evidence": "",
  "english": "Back up and test restoration, map old URLs to new URLs, test redirects and forms, obtain release approval and monitor the live result. This is a proposed reusable workflow, not independent evidence of a completed run. Check the full Hebrew recipe and its limits. Account changes, communications, publication and spending require separate approval.",
  "consent": true,
  "author": "גל מוסקוביץ׳",
  "submitted_at": "2026-10-07T07:47:30.380Z",
  "slug": "submission-muxt1nt8w5tz"
}
